[
  {
    "id": "alangan",
    "name": "Alangan",
    "punongBarangay": "Teresita D. Dela Rea",
    "coordinates": null,
    "psgcCode": "0300806001",
    "classification": "urban",
    "population2024": 7501,
    "term": "2023–2026",
    "officials": [
      {
        "name": "Teresita D. Dela Rea",
        "position": "Punong Barangay",
        "termInPosition": "2nd term"
      },
      {
        "name": "Regino E. Fajardo",
        "position": "Sangguniang Barangay Member",
        "termInPosition": "3rd term"
      },
      {
        "name": "Emelita G. Cobrado",
        "position": "Sangguniang Barangay Member",
        "termInPosition": "2nd term"
      },
      {
        "name": "Raphy V. Aucena",
        "position": "Sangguniang Barangay Member",
        "termInPosition": "3rd term"
      },
      {
        "name": "Jenelyn M. Santos",
        "position": "Sangguniang Barangay Member",
        "termInPosition": "2nd term"
      },
      {
        "name": "Rodrigo G. Gelomina",
        "position": "Sangguniang Barangay Member",
        "termInPosition": "3rd term"
      },
      {
        "name": "Alex T. Valdez",
        "position": "Sangguniang Barangay Member",
        "termInPosition": "1st term"
      },
      {
        "name": "Marietta G. Panganiban",
        "position": "Barangay Secretary"
      },
      {
        "name": "Ellieza D. Polon",
        "position": "SK Chairperson",
        "termInPosition": "1st term"
      },
      {
        "name": "Rechie R. Fajardo",
        "position": "SK Member",
        "termInPosition": "1st term"
      },
      {
        "name": "Erika P. Fenis",
        "position": "SK Member",
        "termInPosition": "1st term"
      },
      {
        "name": "Trisha D. Manansala",
        "position": "SK Member",
        "termInPosition": "1st term"
      },
      {
        "name": "Shamel D. Roque",
        "position": "SK Member",
        "termInPosition": "1st term"
      },
      {
        "name": "Sunshine L. De Guzman",
        "position": "SK Member",
        "termInPosition": "1st term"
      },
      {
        "name": "Jesah Myka E. Picardal",
        "position": "SK Member",
        "termInPosition": "1st term"
      },
      {
        "name": "Mark Lorence A. Rebato",
        "position": "SK Member",
        "termInPosition": "1st term"
      },
      {
        "name": "Vanessa Bianca D. Sinsay",
        "position": "SK Secretary"
      },
      {
        "name": "Loreto B. Angcla Jr.",
        "position": "SK Treasurer"
      }
    ],
    "provenance": {
      "source_name": "Department of the Interior and Local Government",
      "retrieved_at": "2026-09-25",
      "verified": true,
      "verification_note": "Officials from the DILG barangay officials roster, term 2023-2026. Middle names are shown as initials. Population and classification from the PSA 2024 POPCEN.",
      "source_document": "DILG roster of barangay officials, Municipality of Limay, Bataan, term 2023-2026"
    },
    "contactPhone": "0910 621 3165"
  },
  {
    "id": "kitang-i",
    "name": "Kitang I",
    "punongBarangay": "Arnel Q. Bagtas",
    "coordinates": null,
    "psgcCode": "0300806002",
    "classification": "rural",
    "population2024": 2239,
    "term": "2023–2026",
    "officials": [
      {
        "name": "Arnel Q. Bagtas",
        "position": "Punong Barangay",
        "termInPosition": "1st term"
      },
      {
        "name": "Erwin D. Ambrocio",
        "position": "Sangguniang Barangay Member",
        "termInPosition": "3rd term"
      },
      {
        "name": "Arnulfo A. Culanding",
        "position": "Sangguniang Barangay Member",
        "termInPosition": "1st term"
      },
      {
        "name": "Dominador R. Labbao",
        "position": "Sangguniang Barangay Member",
        "termInPosition": "1st term"
      },
      {
        "name": "Rolando A. Cruz",
        "position": "Sangguniang Barangay Member",
        "termInPosition": "1st term"
      },
      {
        "name": "Vianney M. Deogracias",
        "position": "Sangguniang Barangay Member",
        "termInPosition": "1st term"
      },
      {
        "name": "Luisito D. Remorin",
        "position": "Sangguniang Barangay Member",
        "termInPosition": "1st term"
      },
      {
        "name": "German M. Teodoro Sr.",
        "position": "Sangguniang Barangay Member",
        "termInPosition": "1st term"
      },
      {
        "name": "Michelle S. Bautista",
        "position": "Barangay Secretary"
      },
      {
        "name": "Madeline E. Jucdong",
        "position": "Barangay Treasurer"
      },
      {
        "name": "Timothy James A. De Leon",
        "position": "SK Chairperson",
        "termInPosition": "1st term"
      },
      {
        "name": "Tricia May M. Delgado",
        "position": "SK Member",
        "termInPosition": "1st term"
      },
      {
        "name": "Len C. Bagtas",
        "position": "SK Member",
        "termInPosition": "1st term"
      },
      {
        "name": "Paul Asi P. Betco",
        "position": "SK Member",
        "termInPosition": "1st term"
      },
      {
        "name": "Allen S. Gregorio",
        "position": "SK Member",
        "termInPosition": "1st term"
      },
      {
        "name": "John Byron L. Cruz",
        "position": "SK Member",
        "termInPosition": "1st term"
      },
      {
        "name": "John Michael C. Sioson",
        "position": "SK Member",
        "termInPosition": "1st term"
      },
      {
        "name": "Bryan Jones R. Rapirap",
        "position": "SK Member",
        "termInPosition": "1st term"
      },
      {
        "name": "Mheomel R. Martin",
        "position": "SK Secretary"
      },
      {
        "name": "Reann Mae R. Gregorio",
        "position": "SK Treasurer"
      }
    ],
    "provenance": {
      "source_name": "Department of the Interior and Local Government",
      "retrieved_at": "2026-09-25",
      "verified": true,
      "verification_note": "Officials from the DILG barangay officials roster, term 2023-2026. Middle names are shown as initials. Population and classification from the PSA 2024 POPCEN.",
      "source_document": "DILG roster of barangay officials, Municipality of Limay, Bataan, term 2023-2026"
    },
    "contactPhone": "0964 179 1174"
  },
  {
    "id": "kitang-2-luz",
    "name": "Kitang 2 & Luz",
    "punongBarangay": "Leonida S. Navarro",
    "coordinates": null,
    "psgcCode": "0300806003",
    "classification": "urban",
    "population2024": 6209,
    "term": "2023–2026",
    "officials": [
      {
        "name": "Leonida S. Navarro",
        "position": "Punong Barangay",
        "termInPosition": "2nd term"
      },
      {
        "name": "Jesse C. Cabulao",
        "position": "Sangguniang Barangay Member",
        "termInPosition": "1st term"
      },
      {
        "name": "Marissa A. Dominguez",
        "position": "Sangguniang Barangay Member",
        "termInPosition": "1st term"
      },
      {
        "name": "Freddie P. Peralta",
        "position": "Sangguniang Barangay Member",
        "termInPosition": "2nd term"
      },
      {
        "name": "Marco C. De Guzman",
        "position": "Sangguniang Barangay Member",
        "termInPosition": "1st term"
      },
      {
        "name": "Lucy C. Cuevas",
        "position": "Sangguniang Barangay Member",
        "termInPosition": "2nd term"
      },
      {
        "name": "Domingo M. Dimaangay",
        "position": "Sangguniang Barangay Member",
        "termInPosition": "2nd term"
      },
      {
        "name": "Maricris P. Cabral",
        "position": "Sangguniang Barangay Member",
        "termInPosition": "Appointive"
      },
      {
        "name": "Theresa P. Lim",
        "position": "Barangay Secretary"
      },
      {
        "name": "Lorieda C. Razon",
        "position": "Barangay Treasurer"
      },
      {
        "name": "Maricksy Iree Mae O. Cabulao",
        "position": "SK Chairperson",
        "termInPosition": "1st term"
      },
      {
        "name": "Abby Angeli S. Ambrocio",
        "position": "SK Member",
        "termInPosition": "1st term"
      },
      {
        "name": "Kevin G. Peralta",
        "position": "SK Member",
        "termInPosition": "1st term"
      },
      {
        "name": "Lance O. Peralta",
        "position": "SK Member",
        "termInPosition": "1st term"
      },
      {
        "name": "Rose Jane J. Cortez",
        "position": "SK Member",
        "termInPosition": "1st term"
      },
      {
        "name": "Haiden S. Orias",
        "position": "SK Member",
        "termInPosition": "1st term"
      },
      {
        "name": "Raven C. Peralta",
        "position": "SK Member",
        "termInPosition": "1st term"
      },
      {
        "name": "Adrian M. Macuroy",
        "position": "SK Member",
        "termInPosition": "1st term"
      },
      {
        "name": "Angelica S. Buensuceso",
        "position": "SK Treasurer"
      }
    ],
    "provenance": {
      "source_name": "Department of the Interior and Local Government",
      "retrieved_at": "2026-09-25",
      "verified": true,
      "verification_note": "Officials from the DILG barangay officials roster, term 2023-2026. Middle names are shown as initials. Population and classification from the PSA 2024 POPCEN.",
      "source_document": "DILG roster of barangay officials, Municipality of Limay, Bataan, term 2023-2026"
    },
    "contactPhone": "0931 854 0680"
  },
  {
    "id": "lamao",
    "name": "Lamao",
    "punongBarangay": "Leila F. Cruz",
    "coordinates": null,
    "psgcCode": "0300806004",
    "classification": "urban",
    "population2024": 19492,
    "term": "2023–2026",
    "officials": [
      {
        "name": "Leila F. Cruz",
        "position": "Punong Barangay",
        "termInPosition": "1st term"
      },
      {
        "name": "Pilarcita N. Cañete",
        "position": "Sangguniang Barangay Member",